company_name,company_url
AIG損害保険株式会社,https://www.aig.co.jp/sonpo
キンセイ食品株式会社,https://kinsei-s.com
株式会社アール・エム,https://www.r-m.jp
株式会社グローバー,http://www.groover.co.jp/index.html
キリンビール株式会社,http://www.kirin.co.jp/company/about/kirinbrewery/recruit/
株式会社ディファレント,https://different-gr.com/
株式会社御剣商事,http://mitsurugicorp.com/
キヤノンビズアテンダ株式会社　★Canonグループ,http://www.canon-ba.co.jp/staff/
株式会社オープンハウス,https://recruit.openhouse-group.com/career_sales/
株式会社プランニングオフィスエスエムエス,https://www.plan-sms.co.jp/
株式会社オープンハウス,https://recruit.openhouse-group.com/career_sales/
株式会社イノベーター,https://www.bouhancamera-navi.com/
株式会社エクシードジャパン,http://www.exceedjapan.co.jp
株式会社STAR CAREER,https://star-career.co.jp/
株式会社エクシードジャパン,http://www.exceedjapan.co.jp
株式会社Ｂ・Ｐ・Ｓ,https://bps21.jp
株式会社メディカルフロンティア,https://medical-frontier.com/
ザンシン株式会社,https://zanthing.com/recruit/
日本テクノ株式会社,https://www.n-techno.co.jp/
株式会社ウィルグループ,http://willgroup.co.jp/
株式会社ウィルオブ・ワーク（ウィルグループ）,https://willof-work.co.jp/
（株）社会保険研究所,https://www.shaho.co.jp/
株式会社C・S・R,https://csresolution.jp/
株式会社リスト,http://www.rest.co.jp/
株式会社クーリエ,http://www.courier.jpn.com
興亜硝子株式会社,https://www.koaglass.co.jp/
株式会社綜合キャリアオプション ビジネスプロセスソリューション事業本部（キャムコムグループ）,https://www.1049.cc/web/sougo-career-recruit/
株式会社　アルモア,http://www.armor.co.jp
東洋印刷株式会社,https://toyo-print.co.jp/
株式会社メイツ,https://mates-edu.co.jp/
株式会社イスト,https://ist-global.co.jp/
株式会社アイ・ケイ・アイ,https://i-k-i.co.jp
株式会社フレッシュハウス,https://freshhouse.co.jp/
株式会社エステートエージェンシー,http://office-madoguchi.net/index.php
株式会社グロース,http://www.growth777.co.jp/
(株)チーム・チャンネル,https://www.t-c.co.jp/
SANGO株式会社,https://www.san-go.co.jp/
株式会社須藤精密,http://www.sudo-precise.co.jp/
株式会社フーディソン,http://foodison.jp/
株式会社エクスプレス・エージェント,http://www.ex-agent.co.jp/
SocioFuture株式会社,https://www.scft.co.jp/
株式会社ウィモーション,http://wemotion.co.jp
キャリアリンク株式会社（東証プライム上場）,https://www.careerlink.co.jp/
株式会社Ｌｉｎｇ,https://lingcorp.co.jp/
株式会社ジェイシーエス,http://www.japan-cs.info
株式会社ほけんの１１０番,http://e-hoken110.com
株式会社ブルームソリューションズ,https://www.bloom-solutions.com/
株式会社飯田産業,
株式会社ナラティブ,http://arq-hd.com/
ヤマトサイネージ株式会社,https://yamato-signage.com/
株式会社アキュート,https://www.a-cute.co.jp/
株式会社東京海上日動キャリアサービス,
株式会社鍵屋,https://www.kagisapo24.com/
株式会社エイワンプラス,https://www.aone-plus.com/
株式会社STAGEON,https://stageon.jp/
株式会社ヨシノ自動車,http://www.yoshino-motor.co.jp
ニッパク装備株式会社,http://www.nippaku.com/
ビーモーション株式会社,https://www.bemotion.co.jp/staff/
株式会社エンパワー,https://www.en-power.jp/
(株)ジャパネットコミュニケーションズ,http://corporate.japanet.co.jp/
ヒューマンリソシア株式会社,https://recruit.resocia.jp/
株式会社ウィルグループ,http://willgroup.co.jp/
株式会社NECT,http://nect.jp/recruit/
大栄環境グループ,https://daieikankyo-job.net/jobfind-pc/
株式会社アップルパーク,https://www.applepark.jp/
有限会社ネクスト,https://fudousan-bengo.com/
第一カッター興業株式会社（東証プライム上場）,https://www.daiichi-cutter.co.jp/
株式会社アレップス,http://www.areps.co.jp/
AIGパートナーズ株式会社,http://www.aig.co.jp/apc
株式会社ジャパンセル,https://www.jpcell.co.jp
株式会社NEXT TECHNOLOGY,https://nexttechnology.jp
株式会社山栄精機,http://www.s-sanei.co.jp/index.html
株式会社LITALICO（東証プライム上場）,http://litalico.co.jp/
株式会社エクスプレス・エージェント,http://www.ex-agent.co.jp/
パーソルワークスデザイン株式会社（パーソルグループ）,https://www.persol-wd.co.jp/recruit/
バーチャレクス・コンサルティング株式会社,
日本生命保険相互会社,https://www.nissay.co.jp/kaisha/saiyo/chuto/service/
株式会社ストーリー,https://home-story.co.jp/
株式会社ベステート,http://www.besteight.co.jp/
株式会社ルークスグループ,http://lukes-inc.co.jp/about/
株式会社京栄センター,https://kyoeicenter.com/
株式会社サカタ製作所,https://recruit.sakata-s.co.jp/
大和リビング株式会社（大和ハウスグループ）,https://www.daiwaliving.co.jp/
株式会社ＴＨビジネスサポート,https://www.thb-s.co.jp/
株式会社エフアンドエム（東証スタンダード上場）,https://www.fmltd.co.jp/
株式会社アイ・ケイ・アイ,https://i-k-i.co.jp
ALSOK（綜合警備保障株式会社/東証プライム上場）,https://www.alsok.co.jp/
freee株式会社,https://corp.freee.co.jp
アットライティング株式会社,https://at-l.co.jp/
株式会社九州レンタリースサービス,
株式会社インサイド・アウト,http://www.insideout-corp.jp
株式会社アイシ・フュージョン・アソシエイツ,http://www.aixi.info/
株式会社引越社（アリさんマークの引越社）,http://www.2626.co.jp/
株式会社タカギセイコー,http://www.takagi-j.com/
医療法人社団メディカルフロンティア,https://aoki-tsuyoshi.com/
Goo Nextion株式会社,https://goonextion.co.jp/
リオン不動産株式会社,https://lion-realestate.co.jp/
株式会社FUKKO,http://fukko.jp
株式会社BGパートナーズ,https://www.salonfudousan.net/
株式会社サニクリーン東京,http://www.sanikleen-tokyo.co.jp/
株式会社八芳園,http://www.happo-en.com/
日大グラビヤ株式会社,http://www.nichidai-gravure.co.jp/
株式会社フロンティアワーク,https://frontier-work.co.jp/
伸榮産業株式会社,http://www.s-shin-ei.co.jp
株式会社アイビスホールディングス,
株式会社UTo,https://u-t-o.co.jp/
株式会社ウィルオブ・ワーク（ウィルグループ）,https://willof-work.co.jp/
株式会社セントラルヒルズ,http://centralhills.biz/index.html
トリプルアール株式会社,https://www.triple-r.com/
株式会社介助,http://www.kaisuke.co.jp/organization.html
株式会社トライトキャリア,https://tryt-group.co.jp/
スターワークスグループ,https://www.star-w.com/
Man to Man株式会社,http://www.man-to-man-g.com/
株式会社ジェブ,https://www.jeb.bz/
テレコムサービス株式会社,http://www.telecom-service.net/corporate/
株式会社マイワーク,https://www.mywork.co.jp/
クリナップ株式会社（東証プライム上場）,https://cleanup.jp/
株式会社前田硝子,http://www.maeda-glass.co.jp/
株式会社アップル,https://apple-display.com/
株式会社レッカム,http://recoveron.co.jp/
株式会社コムニコ,https://www.comnico.jp/
シーデーピージャパン株式会社,http://www.cdpjp.com/
株式会社プライマリー,https://primary-inc.co.jp/
堀内運送株式会社 東京支店,http://www.horiuchiunso.co.jp/
株式会社リモデルエステート,https://www.remodel-estate.jp/company.html
(株)ジャパネットコミュニケーションズ,http://corporate.japanet.co.jp/
株式会社リモデルエステート,https://www.remodel-estate.jp/company.html
株式会社リモデルエステート,https://www.remodel-estate.jp/
株式会社サプライ,http://www.supply-dental.co.jp/
株式会社テクノパルネット,http://www.technopal-net.co.jp
ウィズライフ株式会社,https://withlife-inc.jp/
サンウエストホーム株式会社,http://www.sunwesthome.co.jp/
株式会社リモデルエステート,https://www.remodel-estate.jp/company.html
有限会社クリオ,http://www.creo-group.jp/
株式会社ONE,https://www.saiyou-one.jp/
ジョリー・ロジャー株式会社,http://www.jolly-roger.co.jp/
株式会社イーエスシー,http://www.askulagent-esc.com/
株式会社マーキュリー,https://mercury-group.co.jp/
NSSマーケティング株式会社,https://nss-marketing.co.jp/
ピタットハウス羽田北糀谷店　スマイル・ホームネッツ(株),http://www.good-smile.co.jp
株式会社トライトエンジニアリング,https://tryt-group.co.jp/
MCO株式会社,https://www.mco-japan.com/
株式会社テルミック,https://www2.telmic.co.jp/
株式会社立花マテリアル,http://tachibana-m.co.jp/
株式会社HONEST STAFF,https://honest-staff.com/
株式会社パティオ,http://www.patio-style.com
株式会社ネオキャリア,https://www.neo-career.co.jp/recruit/
株式会社ミニミニ城北,
株式会社アニスピホールディングス,https://anispi.co.jp/
株式会社リームー,https://re-moo.com
